{
  "id": "api-advanced",
  "title": "Concevoir une API REST en Python avec FastAPI",
  "description": "Conception d'une API REST professionnelle avec FastAPI, Pydantic v2... Projet fil rouge : API de gestion des formations, sessions et inscriptions pour Simplon.",
  "status": "published",
  "objectives": [
    "Mettre en place une architecture FastAPI en couches (models / schemas / services / routes)",
    "Modéliser des entités avec SQLModel et définir les relations",
    "Créer des DTOs robustes avec Pydantic v2 (Create / Update / Read)",
    "Implémenter un CRUD complet avec gestion des règles métier",
    "Écrire des tests automatisés avec pytest et HTTPX (couverture ≥ 70%)",
    "Gérer les erreurs et les codes HTTP de façon centralisée",
    "Implémenter filtres, pagination et tri",
    "Générer et enrichir la documentation Swagger/OpenAPI",
    "Gérer les migrations de base de données avec Alembic"
  ],
  "prerequisites": [
    "Connaissances de base en Python (fonctions, classes, modules)",
    "Notions de REST et HTTP (verbes, codes de statut)",
    "Compréhension des bases de données relationnelles (SQL)"
  ],
  "duration": "8 days",
  "theme": "simplon",
  "thumbnail": "./assets/cover.png",
  "tags": [
    "fastapi", "python", "pydantic", "api", "dto", "sqlmodel", "sqlalchemy",
    "alembic", "pytest", "rest", "backend", "validation", "tests"
  ],
  "language": "fr",
  "version": "1.0.0",
  "authors": [
    {
      "name": "Maxime Lenne",
      "email": "hello@maxime-lenne.fr"
    }
  ],
  "created": "2026-03-02",
  "updated": "2026-03-02"
}
