{
  "id": "sql-joins",
  "title": "SQL Joins",
  "description": "Learn table relationships",
  "status": "published",
  "objectives": [
    "Premier objectif d'apprentissage",
    "Deuxième objectif d'apprentissage",
    "Troisième objectif d'apprentissage"
  ],
  "prerequisites": [
    "Connaissance de base en programmation"
  ],
  "duration": "2 hours",
  "theme": "simplon",
  "thumbnail": "./assets/preview.svg",
  "tags": ["sql", "database", "beginner"],
  "language": "fr",
  "version": "0.1.0",
  "authors": [
    {
      "name": "Maxime Lenne",
      "email": "hello@maxime-lenne.fr"
    }
  ],
  "created": "2025-11-24",
  "updated": "2025-11-24"
}
