{
  "id": "genai-llm-introduction",
  "title": "Fondamentaux de l'IA Générative",
  "description": "Socle commun Bootcamp IA — 1 journée intensive. LLM, tokens, prompt engineering, RAG, agents, MCP.",
  "status": "published",
  "objectives": [
    "Comprendre les mécanismes de l'IA générative (LLM, Transformer, inférence, tokens)",
    "Écrire des prompts structurés et efficaces",
    "Connaître les concepts clefs : RAG, agents, MCP",
    "Choisir sa trajectoire parmi les 3 formations IA"
  ],
  "prerequisites": [
    "Aucun prérequis technique"
  ],
  "duration": "8 hours",
  "theme": "simplon",
  "thumbnail": "./assets/preview.svg",
  "tags": ["ai", "llm", "prompt-engineering", "rag", "agents", "mcp", "beginner"],
  "language": "fr",
  "version": "0.1.0",
  "authors": [
    {
      "name": "Simplon Training Team",
      "email": "training@simplon.co"
    }
  ],
  "created": "2026-04-06",
  "updated": "2026-04-07"
}
